{
  "$schema": "../../../tools/schemas/fable2-gpu-canary-source-inventory-v1.schema.json",
  "schema_version": "1.0.0",
  "corpus": "Fable II Native Renderer G1.5B",
  "generated_on": "2026-09-01",
  "fable_repository": {
    "path": "C:\\Dev\\Fable2Recomp",
    "remote": "https://github.com/FenrisSkoll/Fable2Recomp.git",
    "branch": "fable2-native-renderer-g1.5-reference",
    "commit": "a0d663fc600f74df8e7e87dcf7f18776e23339c9",
    "tree": "a622e93e586be117a9be0ba9b6554ef3a099636c",
    "status": "clean at G1.5B start"
  },
  "canary_repository": {
    "path": "C:\\Dev\\Fable2NativeRendererResearch\\xenia-canary",
    "remote": "https://github.com/xenia-canary/xenia-canary.git",
    "branch": "canary_experimental",
    "upstream": "origin/canary_experimental",
    "ahead": 0,
    "behind": 0,
    "commit": "3a44f20c7bc66db1da583e8a6f0ab740e31908e9",
    "tree": "c343b0a5796590fadc3b78c993bfada51e7e9148",
    "parent": "22708301ba76d10aae6f7d7caac8b1cac9e4a8e6",
    "author_date": "2026-08-28T20:19:01-07:00",
    "committer_date": "2026-08-31T22:07:04+02:00",
    "subject": "[GPU] Replace AC6 ground hack with scalar approximation rounding",
    "status": "clean; HEAD equals the pin; upstream ahead 0, behind 0",
    "license": "BSD-3-Clause",
    "license_sha256": "3D58F25C15634B6EC01D1F133EF798209AE06626AB8D2227B6223D5A9F5113F4",
    "is_shallow": true,
    "available_commit_count": 200,
    "shallow_boundary": "049a55f03679b204379b17996bd032ce54bff156"
  },
  "source_scopes": [
    {
      "repository": "canary",
      "path": "src/xenia/gpu",
      "git_object_sha1": "76ca8c5b5f2c2116a60b102f7e79e8d0594907ca",
      "file_count": 297,
      "role": "shared GPU model, command processor, translators, and backend implementations"
    },
    {
      "repository": "canary",
      "path": "src/xenia/gpu/d3d12",
      "git_object_sha1": "f8396b8d7c59d5d499110eaecc92c5ec4a7b9058",
      "file_count": 23,
      "role": "D3D12 backend"
    },
    {
      "repository": "canary",
      "path": "src/xenia/gpu/vulkan",
      "git_object_sha1": "926c1106702a731d6f85dd5bfdb470977f0714c8",
      "file_count": 23,
      "role": "Vulkan backend"
    },
    {
      "repository": "canary",
      "path": "src/xenia/gpu/shaders",
      "git_object_sha1": "4bec8b510982873a78ef53095f65ce606b5d6cf7",
      "file_count": 161,
      "role": "host shader sources and generated shader artifacts tracked by Canary"
    },
    {
      "repository": "canary",
      "path": "src/xenia/ui",
      "git_object_sha1": "24b00567de885301c57962ed0735eb1b87248cd8",
      "file_count": 149,
      "role": "graphics provider, presenter, and completion timeline abstractions"
    },
    {
      "repository": "canary",
      "path": "src/xenia/ui/d3d12",
      "git_object_sha1": "e7c397deb8c30d27c34347cacd848c51ae6eafe9",
      "file_count": 19,
      "role": "D3D12 provider and presenter"
    },
    {
      "repository": "canary",
      "path": "src/xenia/ui/vulkan",
      "git_object_sha1": "6c396cfd723f4bcd045dea5ba9eaf0ac395160ad",
      "file_count": 42,
      "role": "Vulkan device, provider, presenter, and synchronization"
    },
    {
      "repository": "canary",
      "path": "src/xenia/kernel/xboxkrnl",
      "git_object_sha1": "4c1bba71afcc07b76f4b6572fb54bc554fd8b518",
      "file_count": 38,
      "role": "Xbox kernel video exports that feed the GPU"
    }
  ],
  "key_files": [
    {
      "repository": "canary",
      "path": "LICENSE",
      "blob_sha1": "bc759869a1975823a4e1b1c78cb4e5356cadb7bf",
      "size": 1481,
      "role": "repository licence",
      "symbols": ["Redistribution and use"]
    },
    {
      "repository": "canary",
      "path": "src/xenia/app/xenia_main.cc",
      "blob_sha1": "ab94373301c8c4798c97ffcf2f047669fa28b82f",
      "size": 29240,
      "role": "graphics backend selection",
      "symbols": ["EmulatorApp::CreateGraphicsSystem"]
    },
    {
      "repository": "canary",
      "path": "src/xenia/emulator.cc",
      "blob_sha1": "cf1856972979fcd247881e983790556f1539ce67",
      "size": 63922,
      "role": "emulator ownership and setup order",
      "symbols": ["Emulator::Setup", "InitializeShaderStorage"]
    },
    {
      "repository": "canary",
      "path": "src/xenia/gpu/graphics_system.h",
      "blob_sha1": "0c616dd7f461c95ed7f827ecbe362255f93a11d9",
      "size": 4369,
      "role": "GPU system ownership contract",
      "symbols": ["class GraphicsSystem", "RegisterFile* register_file_"]
    },
    {
      "repository": "canary",
      "path": "src/xenia/gpu/graphics_system.cc",
      "blob_sha1": "851513945b680eebfaa6b3892de039e7ad263751",
      "size": 16003,
      "role": "GPU setup, MMIO, interrupt, limiter, and shutdown",
      "symbols": ["GraphicsSystem::Setup", "GraphicsSystem::Shutdown"]
    },
    {
      "repository": "canary",
      "path": "src/xenia/kernel/xboxkrnl/xboxkrnl_video.cc",
      "blob_sha1": "12835232b76318264acbdf1d77e069b88b896a12",
      "size": 23752,
      "role": "guest video exports and swap packet construction",
      "symbols": ["VdInitializeRingBuffer", "VdSwap_entry"]
    },
    {
      "repository": "canary",
      "path": "src/xenia/gpu/command_processor.h",
      "blob_sha1": "95be5ec553adedf36d20f34bf5f87de24c878283",
      "size": 20347,
      "role": "shared command processor state and interface",
      "symbols": ["class CommandProcessor"]
    },
    {
      "repository": "canary",
      "path": "src/xenia/gpu/command_processor.cc",
      "blob_sha1": "5865d9036af6e548d2832e55ec91adc4bd02c93a",
      "size": 54193,
      "role": "command worker, ring pointers, waits, interrupts, and common register effects",
      "symbols": ["CommandProcessor::WorkerThreadMain", "CommandProcessor::InitializeRingBuffer"]
    },
    {
      "repository": "canary",
      "path": "src/xenia/gpu/pm4_command_processor_declare.h",
      "blob_sha1": "93a9aaf6020e9a71bbc031e6e681aa0232030304",
      "size": 3961,
      "role": "PM4 handler declarations",
      "symbols": ["ExecutePacketType3Draw", "ExecutePacketType3_XE_SWAP"]
    },
    {
      "repository": "canary",
      "path": "src/xenia/gpu/pm4_command_processor_implement.h",
      "blob_sha1": "e2560f9c19574ef98c5cb4fb3227124ddb13d188",
      "size": 54081,
      "role": "PM4 packet decoding and operation dispatch",
      "symbols": ["COMMAND_PROCESSOR::ExecutePacket", "COMMAND_PROCESSOR::ExecutePacketType3Draw"]
    },
    {
      "repository": "canary",
      "path": "src/xenia/gpu/register_file.h",
      "blob_sha1": "8128bdcc93480d160628cc325c54d84772d1000f",
      "size": 2700,
      "role": "Xenos register file definition",
      "symbols": ["class RegisterFile", "kRegisterCount"]
    },
    {
      "repository": "canary",
      "path": "src/xenia/gpu/register_file.cc",
      "blob_sha1": "c697852e4775c1982c18a7e17a6d24bbc827a0e1",
      "size": 4941,
      "role": "register metadata and reset defaults",
      "symbols": ["RegisterFile::RegisterFile", "RegisterFile::GetRegisterInfo"]
    },
    {
      "repository": "canary",
      "path": "src/xenia/gpu/register_table.inc",
      "blob_sha1": "0b70f329d53ec49eee8d79ffff90faada8d5dcc8",
      "size": 196019,
      "role": "generated register metadata table",
      "symbols": ["XE_GPU_REGISTER"]
    },
    {
      "repository": "canary",
      "path": "src/xenia/gpu/primitive_processor.h",
      "blob_sha1": "b644510168ced905df5c4d3552e4cd701a846e62",
      "size": 42417,
      "role": "primitive and index conversion state",
      "symbols": ["class PrimitiveProcessor", "ProcessingResult"]
    },
    {
      "repository": "canary",
      "path": "src/xenia/gpu/primitive_processor.cc",
      "blob_sha1": "129b5a16aa12360a6ecd01fcce197d75192d8673",
      "size": 81814,
      "role": "primitive processing implementation",
      "symbols": ["PrimitiveProcessor::Process", "PrimitiveProcessor::IsResetUsed"]
    },
    {
      "repository": "canary",
      "path": "src/xenia/gpu/draw_util.cc",
      "blob_sha1": "ec8c417c430f9ed1ba4b765e04d081b67111785a",
      "size": 68871,
      "role": "draw and resolve state decoding",
      "symbols": ["GetResolveInfo", "ResolveInfo::GetCopyShader"]
    },
    {
      "repository": "canary",
      "path": "src/xenia/gpu/draw_extent_estimator.cc",
      "blob_sha1": "7162a322fb260744d7e4fbfe25ea6519d51a4406",
      "size": 14835,
      "role": "draw extent estimation",
      "symbols": ["DrawExtentEstimator::EstimateVertexMaxY", "DrawExtentEstimator::Estimate"]
    },
    {
      "repository": "canary",
      "path": "src/xenia/gpu/shader.h",
      "blob_sha1": "fa3141d908b1b445ca5455794d8a20fd5f4db8d0",
      "size": 45235,
      "role": "Xenos shader analysis and translation model",
      "symbols": ["class Shader", "class ShaderTranslator"]
    },
    {
      "repository": "canary",
      "path": "src/xenia/gpu/shader.cc",
      "blob_sha1": "b34a8a83b605c081e372fd7f9c8decc87447087c",
      "size": 5870,
      "role": "shader ownership and binding metadata",
      "symbols": ["Shader::Shader", "Shader::GetOrCreateTranslation"]
    },
    {
      "repository": "canary",
      "path": "src/xenia/gpu/shader_translator.cc",
      "blob_sha1": "24213af8778db9bece016d31523ef95804c043ec",
      "size": 61904,
      "role": "Xenos ucode analysis and shared translation",
      "symbols": ["Shader::AnalyzeUcode", "ShaderTranslator::TranslateAnalyzedShader"]
    },
    {
      "repository": "canary",
      "path": "src/xenia/gpu/dxbc_shader_translator.cc",
      "blob_sha1": "5eee7f8df33b57b9e440b5a68236a2e4b5ab7747",
      "size": 164889,
      "role": "DXBC host shader generation",
      "symbols": ["DxbcShaderTranslator::StartTranslation", "DxbcShaderTranslator::CompleteTranslation"]
    },
    {
      "repository": "canary",
      "path": "src/xenia/gpu/spirv_shader_translator.cc",
      "blob_sha1": "690b881cd287176d9a638ef73a4288b5b894e92a",
      "size": 184185,
      "role": "SPIR-V host shader generation",